{
  "id": "ee-land-cover-registered",
  "recordKind": "registered_source",
  "title": "Example global land-cover collection (EXAMPLE, not onboarded)",
  "publisher": "Example publisher",
  "sourceUrl": "https://example.org/land-cover",
  "licence": {
    "name": "Example non-commercial licence",
    "usageRights": "non_commercial",
    "authorization": {
      "status": "not_reviewed"
    }
  },
  "capability": "land_cover",
  "variables": [
    {
      "name": "land_cover_class",
      "rawUnit": "class code",
      "normalizedUnit": "category",
      "scaleMeters": 10
    }
  ],
  "temporalCoverage": {
    "start": "2024-01-01",
    "endExclusive": "2025-01-01",
    "boundary": "half_open_start_inclusive_end_exclusive",
    "timezone": "UTC"
  },
  "spatialCoverage": {
    "type": "bbox",
    "crs": "EPSG:4326",
    "bbox": [77.6, 12.92, 77.65, 12.95]
  },
  "qualityStatus": "unreviewed",
  "accessTier": "public_global",
  "eligibilityNotes": "Registration/eligibility terms not yet reviewed."
}
